INITIALIZATION
CREATE TABLE JOIN_TABLE_1(ID INT, NAME CHAR);
SUCCESS
CREATE TABLE JOIN_TABLE_2(ID INT, NUM INT);
SUCCESS
CREATE TABLE JOIN_TABLE_3(ID INT, NUM2 INT);
SUCCESS

INSERT INTO JOIN_TABLE_1 VALUES (1, 'A');
SUCCESS
INSERT INTO JOIN_TABLE_1 VALUES (2, 'B');
SUCCESS
INSERT INTO JOIN_TABLE_1 VALUES (3, 'C');
SUCCESS

INSERT INTO JOIN_TABLE_2 VALUES (1, 2);
SUCCESS
INSERT INTO JOIN_TABLE_2 VALUES (2, 15);
SUCCESS

INSERT INTO JOIN_TABLE_3 VALUES (1, 120);
SUCCESS
ANALYZE TABLE JOIN_TABLE_1;
SUCCESS
ANALYZE TABLE JOIN_TABLE_2;
SUCCESS
ANALYZE TABLE JOIN_TABLE_3;
SUCCESS

ENSURE:NLJ SELECT * FROM JOIN_TABLE_1 , JOIN_TABLE_2;
SELECT * FROM JOIN_TABLE_1 , JOIN_TABLE_2;
ID | NAME | ID | NUM
1 | A | 1 | 2
2 | B | 1 | 2
3 | C | 1 | 2
1 | A | 2 | 15
2 | B | 2 | 15
3 | C | 2 | 15
ENSURE:NLJ SELECT * FROM JOIN_TABLE_1 , JOIN_TABLE_3;
SELECT * FROM JOIN_TABLE_1 , JOIN_TABLE_3;
ID | NAME | ID | NUM2
1 | A | 1 | 120
2 | B | 1 | 120
3 | C | 1 | 120
ENSURE:NLJ SELECT * FROM JOIN_TABLE_2 , JOIN_TABLE_3;
SELECT * FROM JOIN_TABLE_2 , JOIN_TABLE_3;
ID | NUM | ID | NUM2
1 | 2 | 1 | 120
2 | 15 | 1 | 120


ENSURE:NLJ SELECT * FROM JOIN_TABLE_1 INNER JOIN JOIN_TABLE_2 ON JOIN_TABLE_1.ID = JOIN_TABLE_2.ID WHERE JOIN_TABLE_2.ID=1;
SELECT * FROM JOIN_TABLE_1 INNER JOIN JOIN_TABLE_2 ON JOIN_TABLE_1.ID = JOIN_TABLE_2.ID WHERE JOIN_TABLE_2.ID=1;
ID | NAME | ID | NUM
1 | A | 1 | 2

ENSURE:NLJ SELECT * FROM JOIN_TABLE_1 INNER JOIN JOIN_TABLE_3 ON JOIN_TABLE_1.ID = JOIN_TABLE_3.ID WHERE JOIN_TABLE_3.ID=1;
SELECT * FROM JOIN_TABLE_1 INNER JOIN JOIN_TABLE_3 ON JOIN_TABLE_1.ID = JOIN_TABLE_3.ID WHERE JOIN_TABLE_3.ID=1;
ID | NAME | ID | NUM2
1 | A | 1 | 120

INSERT INTO JOIN_TABLE_2 VALUES (3, 100);
SUCCESS
INSERT INTO JOIN_TABLE_2 VALUES (4, 100);
SUCCESS
INSERT INTO JOIN_TABLE_2 VALUES (5, 100);
SUCCESS
INSERT INTO JOIN_TABLE_2 VALUES (6, 100);
SUCCESS
INSERT INTO JOIN_TABLE_2 VALUES (7, 100);
SUCCESS
INSERT INTO JOIN_TABLE_2 VALUES (8, 100);
SUCCESS
INSERT INTO JOIN_TABLE_3 VALUES (3, 800);
SUCCESS



ENSURE:NLJ SELECT * FROM JOIN_TABLE_1 INNER JOIN JOIN_TABLE_2 ON JOIN_TABLE_1.ID = JOIN_TABLE_2.ID WHERE JOIN_TABLE_2.ID=1;
SELECT * FROM JOIN_TABLE_1 INNER JOIN JOIN_TABLE_2 ON JOIN_TABLE_1.ID = JOIN_TABLE_2.ID WHERE JOIN_TABLE_2.ID=1;
ID | NAME | ID | NUM
1 | A | 1 | 2

ENSURE:NLJ SELECT * FROM JOIN_TABLE_1, JOIN_TABLE_2 WHERE JOIN_TABLE_1.ID = JOIN_TABLE_2.ID AND JOIN_TABLE_2.ID=1;
SELECT * FROM JOIN_TABLE_1, JOIN_TABLE_2 WHERE JOIN_TABLE_1.ID = JOIN_TABLE_2.ID AND JOIN_TABLE_2.ID=1;
ID | NAME | ID | NUM
1 | A | 1 | 2

SELECT * FROM JOIN_TABLE_1, JOIN_TABLE_2, JOIN_TABLE_3 WHERE JOIN_TABLE_1.ID = JOIN_TABLE_2.ID AND JOIN_TABLE_2.ID=JOIN_TABLE_3.ID AND JOIN_TABLE_2.ID=1;
ID | NAME | ID | NUM | ID | NUM2
1 | A | 1 | 2 | 1 | 120

SELECT * FROM JOIN_TABLE_1 INNER JOIN JOIN_TABLE_2 ON JOIN_TABLE_1.ID = JOIN_TABLE_2.ID WHERE JOIN_TABLE_2.ID=1;
ID | NAME | ID | NUM
1 | A | 1 | 2

SELECT * FROM JOIN_TABLE_1, JOIN_TABLE_2 WHERE JOIN_TABLE_1.ID = JOIN_TABLE_2.ID AND JOIN_TABLE_2.ID=1;
ID | NAME | ID | NUM
1 | A | 1 | 2

SELECT * FROM JOIN_TABLE_1, JOIN_TABLE_2, JOIN_TABLE_3 WHERE JOIN_TABLE_1.ID = JOIN_TABLE_2.ID AND JOIN_TABLE_2.ID=JOIN_TABLE_3.ID AND JOIN_TABLE_2.ID=1;
ID | NAME | ID | NUM | ID | NUM2
1 | A | 1 | 2 | 1 | 120

SELECT * FROM JOIN_TABLE_1, JOIN_TABLE_2, JOIN_TABLE_3 WHERE JOIN_TABLE_1.ID = JOIN_TABLE_2.ID AND JOIN_TABLE_2.ID>JOIN_TABLE_3.ID AND JOIN_TABLE_2.ID=1;
ID | NAME | ID | NUM | ID | NUM2

SELECT * FROM JOIN_TABLE_1, JOIN_TABLE_2, JOIN_TABLE_3 WHERE JOIN_TABLE_1.ID = JOIN_TABLE_2.ID AND JOIN_TABLE_2.ID>JOIN_TABLE_3.ID AND JOIN_TABLE_2.ID=1 AND JOIN_TABLE_2.ID>0;
ID | NAME | ID | NUM | ID | NUM2

DELETE FROM JOIN_TABLE_1;
SUCCESS
DELETE FROM JOIN_TABLE_2;
SUCCESS
DELETE FROM JOIN_TABLE_3;
SUCCESS

SET USE_CASCADE=1;
SUCCESS

INSERT INTO JOIN_TABLE_1 VALUES (1, 'A');
SUCCESS
INSERT INTO JOIN_TABLE_2 VALUES (1, 2);
SUCCESS
INSERT INTO JOIN_TABLE_3 VALUES (1, 120);
SUCCESS
INSERT INTO JOIN_TABLE_3 VALUES (3, 800);
SUCCESS

ANALYZE TABLE JOIN_TABLE_1;
SUCCESS
ANALYZE TABLE JOIN_TABLE_2;
SUCCESS
ANALYZE TABLE JOIN_TABLE_3;
SUCCESS

ENSURE:NLJ SELECT * FROM JOIN_TABLE_1 INNER JOIN JOIN_TABLE_2 ON JOIN_TABLE_1.ID = JOIN_TABLE_2.ID;
SELECT * FROM JOIN_TABLE_1 INNER JOIN JOIN_TABLE_2 ON JOIN_TABLE_1.ID = JOIN_TABLE_2.ID;
ID | NAME | ID | NUM
1 | A | 1 | 2

INSERT INTO JOIN_TABLE_1 VALUES (2, 'B');
SUCCESS
INSERT INTO JOIN_TABLE_1 VALUES (3, 'C');
SUCCESS
INSERT INTO JOIN_TABLE_2 VALUES (2, 15);
SUCCESS
INSERT INTO JOIN_TABLE_2 VALUES (3, 100);
SUCCESS
INSERT INTO JOIN_TABLE_2 VALUES (4, 100);
SUCCESS
INSERT INTO JOIN_TABLE_2 VALUES (5, 100);
SUCCESS
INSERT INTO JOIN_TABLE_2 VALUES (6, 100);
SUCCESS
INSERT INTO JOIN_TABLE_2 VALUES (7, 100);
SUCCESS
INSERT INTO JOIN_TABLE_2 VALUES (8, 100);
SUCCESS
INSERT INTO JOIN_TABLE_2 VALUES (9, 100);
SUCCESS
INSERT INTO JOIN_TABLE_2 VALUES (10, 100);
SUCCESS
INSERT INTO JOIN_TABLE_2 VALUES (11, 100);
SUCCESS
INSERT INTO JOIN_TABLE_2 VALUES (12, 100);
SUCCESS
INSERT INTO JOIN_TABLE_2 VALUES (13, 100);
SUCCESS
INSERT INTO JOIN_TABLE_2 VALUES (14, 100);
SUCCESS
INSERT INTO JOIN_TABLE_2 VALUES (15, 100);
SUCCESS
INSERT INTO JOIN_TABLE_2 VALUES (16, 100);
SUCCESS
INSERT INTO JOIN_TABLE_2 VALUES (17, 100);
SUCCESS
INSERT INTO JOIN_TABLE_2 VALUES (18, 100);
SUCCESS
INSERT INTO JOIN_TABLE_2 VALUES (19, 100);
SUCCESS
INSERT INTO JOIN_TABLE_2 VALUES (20, 100);
SUCCESS
INSERT INTO JOIN_TABLE_2 VALUES (21, 100);
SUCCESS
INSERT INTO JOIN_TABLE_2 VALUES (22, 100);
SUCCESS
INSERT INTO JOIN_TABLE_2 VALUES (23, 100);
SUCCESS
INSERT INTO JOIN_TABLE_2 VALUES (24, 100);
SUCCESS
INSERT INTO JOIN_TABLE_2 VALUES (25, 100);
SUCCESS
INSERT INTO JOIN_TABLE_2 VALUES (26, 100);
SUCCESS
INSERT INTO JOIN_TABLE_2 VALUES (27, 100);
SUCCESS
INSERT INTO JOIN_TABLE_2 VALUES (28, 100);
SUCCESS
INSERT INTO JOIN_TABLE_2 VALUES (29, 100);
SUCCESS
INSERT INTO JOIN_TABLE_2 VALUES (30, 100);
SUCCESS
INSERT INTO JOIN_TABLE_2 VALUES (31, 100);
SUCCESS
INSERT INTO JOIN_TABLE_2 VALUES (32, 100);
SUCCESS
INSERT INTO JOIN_TABLE_2 VALUES (33, 100);
SUCCESS
INSERT INTO JOIN_TABLE_2 VALUES (34, 100);
SUCCESS
INSERT INTO JOIN_TABLE_2 VALUES (35, 100);
SUCCESS
INSERT INTO JOIN_TABLE_2 VALUES (36, 100);
SUCCESS
INSERT INTO JOIN_TABLE_2 VALUES (37, 100);
SUCCESS
INSERT INTO JOIN_TABLE_2 VALUES (38, 100);
SUCCESS
INSERT INTO JOIN_TABLE_2 VALUES (39, 100);
SUCCESS
INSERT INTO JOIN_TABLE_2 VALUES (40, 100);
SUCCESS
INSERT INTO JOIN_TABLE_2 VALUES (41, 100);
SUCCESS
INSERT INTO JOIN_TABLE_2 VALUES (42, 100);
SUCCESS
INSERT INTO JOIN_TABLE_2 VALUES (43, 100);
SUCCESS
INSERT INTO JOIN_TABLE_2 VALUES (44, 100);
SUCCESS
INSERT INTO JOIN_TABLE_2 VALUES (45, 100);
SUCCESS
INSERT INTO JOIN_TABLE_2 VALUES (46, 100);
SUCCESS
INSERT INTO JOIN_TABLE_2 VALUES (47, 100);
SUCCESS
INSERT INTO JOIN_TABLE_2 VALUES (48, 100);
SUCCESS
INSERT INTO JOIN_TABLE_2 VALUES (49, 100);
SUCCESS
INSERT INTO JOIN_TABLE_2 VALUES (50, 100);
SUCCESS
INSERT INTO JOIN_TABLE_2 VALUES (51, 100);
SUCCESS
INSERT INTO JOIN_TABLE_2 VALUES (52, 100);
SUCCESS
INSERT INTO JOIN_TABLE_2 VALUES (53, 100);
SUCCESS
INSERT INTO JOIN_TABLE_2 VALUES (54, 100);
SUCCESS
INSERT INTO JOIN_TABLE_2 VALUES (55, 100);
SUCCESS
INSERT INTO JOIN_TABLE_2 VALUES (56, 100);
SUCCESS
INSERT INTO JOIN_TABLE_2 VALUES (57, 100);
SUCCESS
INSERT INTO JOIN_TABLE_2 VALUES (58, 100);
SUCCESS
INSERT INTO JOIN_TABLE_2 VALUES (59, 100);
SUCCESS
INSERT INTO JOIN_TABLE_2 VALUES (60, 100);
SUCCESS

INSERT INTO JOIN_TABLE_3 VALUES (2, 120);
SUCCESS
INSERT INTO JOIN_TABLE_3 VALUES (4, 120);
SUCCESS
INSERT INTO JOIN_TABLE_3 VALUES (5, 120);
SUCCESS
INSERT INTO JOIN_TABLE_3 VALUES (6, 120);
SUCCESS
INSERT INTO JOIN_TABLE_3 VALUES (7, 120);
SUCCESS
INSERT INTO JOIN_TABLE_3 VALUES (8, 120);
SUCCESS
INSERT INTO JOIN_TABLE_3 VALUES (9, 120);
SUCCESS
INSERT INTO JOIN_TABLE_3 VALUES (10, 120);
SUCCESS
INSERT INTO JOIN_TABLE_3 VALUES (11, 120);
SUCCESS
INSERT INTO JOIN_TABLE_3 VALUES (12, 120);
SUCCESS
INSERT INTO JOIN_TABLE_3 VALUES (13, 120);
SUCCESS
INSERT INTO JOIN_TABLE_3 VALUES (14, 120);
SUCCESS
INSERT INTO JOIN_TABLE_3 VALUES (15, 120);
SUCCESS
INSERT INTO JOIN_TABLE_3 VALUES (16, 120);
SUCCESS
INSERT INTO JOIN_TABLE_3 VALUES (17, 120);
SUCCESS
INSERT INTO JOIN_TABLE_3 VALUES (18, 120);
SUCCESS
INSERT INTO JOIN_TABLE_3 VALUES (19, 120);
SUCCESS
INSERT INTO JOIN_TABLE_3 VALUES (20, 120);
SUCCESS
INSERT INTO JOIN_TABLE_3 VALUES (21, 120);
SUCCESS
INSERT INTO JOIN_TABLE_3 VALUES (22, 120);
SUCCESS
INSERT INTO JOIN_TABLE_3 VALUES (23, 120);
SUCCESS
INSERT INTO JOIN_TABLE_3 VALUES (24, 120);
SUCCESS
INSERT INTO JOIN_TABLE_3 VALUES (25, 120);
SUCCESS
INSERT INTO JOIN_TABLE_3 VALUES (26, 120);
SUCCESS
INSERT INTO JOIN_TABLE_3 VALUES (27, 120);
SUCCESS
INSERT INTO JOIN_TABLE_3 VALUES (28, 120);
SUCCESS
INSERT INTO JOIN_TABLE_3 VALUES (29, 120);
SUCCESS
INSERT INTO JOIN_TABLE_3 VALUES (30, 120);
SUCCESS
INSERT INTO JOIN_TABLE_3 VALUES (31, 120);
SUCCESS
INSERT INTO JOIN_TABLE_3 VALUES (32, 120);
SUCCESS
INSERT INTO JOIN_TABLE_3 VALUES (33, 120);
SUCCESS
INSERT INTO JOIN_TABLE_3 VALUES (34, 120);
SUCCESS
INSERT INTO JOIN_TABLE_3 VALUES (35, 120);
SUCCESS
INSERT INTO JOIN_TABLE_3 VALUES (36, 120);
SUCCESS
INSERT INTO JOIN_TABLE_3 VALUES (37, 120);
SUCCESS
INSERT INTO JOIN_TABLE_3 VALUES (38, 120);
SUCCESS
INSERT INTO JOIN_TABLE_3 VALUES (39, 120);
SUCCESS
INSERT INTO JOIN_TABLE_3 VALUES (40, 120);
SUCCESS
INSERT INTO JOIN_TABLE_3 VALUES (41, 120);
SUCCESS
INSERT INTO JOIN_TABLE_3 VALUES (42, 120);
SUCCESS
INSERT INTO JOIN_TABLE_3 VALUES (43, 120);
SUCCESS
INSERT INTO JOIN_TABLE_3 VALUES (44, 120);
SUCCESS
INSERT INTO JOIN_TABLE_3 VALUES (45, 120);
SUCCESS
INSERT INTO JOIN_TABLE_3 VALUES (46, 120);
SUCCESS
INSERT INTO JOIN_TABLE_3 VALUES (47, 120);
SUCCESS
INSERT INTO JOIN_TABLE_3 VALUES (48, 120);
SUCCESS
INSERT INTO JOIN_TABLE_3 VALUES (49, 120);
SUCCESS
INSERT INTO JOIN_TABLE_3 VALUES (50, 120);
SUCCESS
INSERT INTO JOIN_TABLE_3 VALUES (51, 120);
SUCCESS
INSERT INTO JOIN_TABLE_3 VALUES (52, 120);
SUCCESS
INSERT INTO JOIN_TABLE_3 VALUES (53, 120);
SUCCESS
INSERT INTO JOIN_TABLE_3 VALUES (54, 120);
SUCCESS
INSERT INTO JOIN_TABLE_3 VALUES (55, 120);
SUCCESS
INSERT INTO JOIN_TABLE_3 VALUES (56, 120);
SUCCESS
INSERT INTO JOIN_TABLE_3 VALUES (57, 120);
SUCCESS
INSERT INTO JOIN_TABLE_3 VALUES (58, 120);
SUCCESS
INSERT INTO JOIN_TABLE_3 VALUES (59, 120);
SUCCESS
INSERT INTO JOIN_TABLE_3 VALUES (60, 120);
SUCCESS

ANALYZE TABLE JOIN_TABLE_1;
SUCCESS
ANALYZE TABLE JOIN_TABLE_2;
SUCCESS
ANALYZE TABLE JOIN_TABLE_3;
SUCCESS

ENSURE:HASHJOIN SELECT * FROM JOIN_TABLE_1 INNER JOIN JOIN_TABLE_2 ON JOIN_TABLE_1.ID = JOIN_TABLE_2.ID;
SELECT * FROM JOIN_TABLE_1 INNER JOIN JOIN_TABLE_2 ON JOIN_TABLE_1.ID = JOIN_TABLE_2.ID;
ID | NAME | ID | NUM
1 | A | 1 | 2
2 | B | 2 | 15
3 | C | 3 | 100

ENSURE:NLJ SELECT * FROM JOIN_TABLE_1,JOIN_TABLE_2 WHERE JOIN_TABLE_1.ID > JOIN_TABLE_2.ID;
SELECT * FROM JOIN_TABLE_1,JOIN_TABLE_2 WHERE JOIN_TABLE_1.ID > JOIN_TABLE_2.ID;
ID | NAME | ID | NUM
2 | B | 1 | 2
3 | C | 1 | 2
3 | C | 2 | 15


ENSURE:HASHJOIN SELECT * FROM JOIN_TABLE_2 INNER JOIN JOIN_TABLE_3 ON JOIN_TABLE_2.ID=JOIN_TABLE_3.ID;

ENSURE:NLJ SELECT * FROM JOIN_TABLE_2 INNER JOIN JOIN_TABLE_3 ON JOIN_TABLE_2.ID < JOIN_TABLE_3.ID WHERE JOIN_TABLE_2.ID = 1 AND JOIN_TABLE_3.ID = 2;
SELECT * FROM JOIN_TABLE_2 INNER JOIN JOIN_TABLE_3 ON JOIN_TABLE_2.ID < JOIN_TABLE_3.ID WHERE JOIN_TABLE_2.ID = 1 AND JOIN_TABLE_3.ID = 2;
ID | NUM | ID | NUM2
1 | 2 | 2 | 120
